collaboration,description,difficulty,hours_per_week,number_weeks_months,free,id_course,n_reviews,new,rating,school,skills,title,url,time_range,duration_total_hours,"Product Managers are responsible for designing and delivering a profitable product or feature into the market. In this program, you will learn to define product strategy and KPIs based on market analysis, pitch a product vision to get stakeholder buy-in, and design a user-centered prototype that adheres to engineering constraints. Then, you will develop an execution timeline that handles competing priorities, communicate a product roadmap that builds consensus amongst internal stakeholders, and create a comprehensive go-to-market plan based on product KPIs. Finally, you will build tests to enhance product features based on market data.
",1,10,4.0,0,nd036,394.0,1,92.9442,School of Business,"Product Strategy, Product Design, Product Development, Design Sprint, Product Launch",Become a Product Manager,https://www.udacity.com/course/product-manager-nanodegree--nd036,months,160.0
Intel,"Leverage the Intel® Distribution of OpenVINO™ Toolkit to fast-track development of high-performance computer vision and deep learning inference applications, and run pre-trained deep learning models for computer vision on-premise. You will identify key hardware specifications of various hardware types (CPU, VPU, FPGA, and Integrated GPU), and utilize the Intel® DevCloud for the Edge to test model performance on the various hardware types. Finally, you will use software tools to optimize deep learning models to improve performance of Edge AI systems. ",0,10,3.0,0,nd131,224.0,1,93.9286,School of Artificial Intelligence,"Edge AI, Computer Vision, Deep Learning, Edge Computing, AI Modeling, Deep Neural Networks (DNN), Convolutional Neural Networks (CNN), IoT, Intel® Distribution of OpenVINO™ Toolkit, Intel® DevCloud for the Edge",Intel® Edge AI for IoT Developers,https://www.udacity.com/course/intel-edge-ai-for-iot-developers-nanodegree--nd131,months,120.0
,"During the Growth Product Manager Nanodegree program, you will learn to build acquisition funnels, identify core customers, and optimize growth loop models. Then, you will learn how to analyze your results and make improvements to your strategies. Next, you will learn activation theories on how to decrease time-to-value and friction for both B2C and B2B product users, as well as retention theories, for creating audiences and increasing engagement. Finally, you will learn the ins and outs of monetization, from designing pricing plans to determining optimal price points using pricing metrics.",2,10,3.0,0,nd037,0.0,1,,School of Business,"Product Management, Growth Strategy, Customer Acquisition, Activation Strategy, Monetization Strategy, Performance Optimization",Become a Growth Product Manager,https://www.udacity.com/course/growth-product-manager-nanodegree--nd037,months,120.0
,"Learn to build, evaluate, and integrate predictive models that have the power to transform patient outcomes.  Begin by classifying and segmenting 2D and 3D medical images to augment diagnosis and then move on to modeling patient outcomes with electronic health records to optimize clinical trial testing decisions. Finally, build an algorithm that uses data collected from wearable devices to estimate the wearer’s pulse rate in the presence of motion.",0,15,4.0,0,nd320,82.0,1,90.7317,School of Artificial Intelligence,"Artificial Intelligence, 2D Medical Imaging, 3D Medical Imaging, Electronic Health Record Data, Deep Learning, Wearable Device Data, Supervised Learning",AI for Healthcare,https://www.udacity.com/course/ai-for-healthcare-nanodegree--nd320,months,240.0
,"You’ll learn how to create a digital user experience that is ready to be handed off for development. You’ll start by building familiarity and fluency with design research fundamentals to identify the user and the solutions they need. You’ll then synthesize your research, and use design sprints to take an idea from concept to low-fidelity prototype. Finally, you’ll learn how to turn your low-fidelity prototype into a high-fidelity design, and improve its performance based on data.

Along the way, you’ll complete projects that can be incorporated into a UX portfolio at the end of the program in order to showcase your capabilities to future employers.",1,10,3.0,0,nd578,591.0,1,94.2809,School of Business,"User Research, User Experience, Prototyping, Interactive Design, User Interface Design, Usability Testing",Become a UX Designer,https://www.udacity.com/course/ux-designer-nanodegree--nd578,months,120.0
Insight,"Learn to design data models, build data warehouses and data lakes, automate data pipelines, and work with massive datasets. At the end of the program, you’ll combine your new skills by completing a capstone project.",2,10,5.0,0,nd027,822.0,1,91.2409,School of Data Science,"Data Modeling, Data Pipelines, Data Lakes, Spark, Airflow",Become a Data Engineer,https://www.udacity.com/course/data-engineer-nanodegree--nd027,months,200.0
"Bertelsmann, Figure Eight, IBM Watson, Insight, Kaggle, Starbucks","You’ll master the skills necessary to become a successful Data Scientist. You’ll work on projects designed by industry experts, and learn to run data pipelines, design experiments, build recommendation systems, and deploy solutions to the cloud.
",0,10,4.0,0,nd025,688.0,1,93.2558,School of Data Science,"Machine Learning, Deep Learning, Software Engineering",Become a Data Scientist,https://www.udacity.com/course/data-scientist-nanodegree--nd025,months,160.0
"AWS, Facebook Artificial Intelligence","Become an expert in neural networks, and learn to implement them using the deep learning framework PyTorch. Build convolutional networks for image recognition, recurrent networks for sequence generation, generative adversarial networks for image generation, and learn how to deploy models accessible from a website.",2,12,4.0,0,nd101,2840.0,0,93.2676,School of Artificial Intelligence,"Deep Learning, Neural Networks, Jupyter Notebooks, CNNs, GANs",Deep Learning,https://www.udacity.com/course/deep-learning-nanodegree--nd101,months,192.0
,"Learn the basics of programming through HTML, CSS, and Python. Explore possible programming paths with our final project selection. Get confident in your ability to think and problem-solve like a programmer. Be primed and ready for our career-ready programs after mastering these projects.",1,10,4.0,0,nd000,2975.0,0,93.5597,School of Programming & Development,"Introduction to Programming, HTML, CSS, Python",Learn to Code,https://www.udacity.com/course/intro-to-programming-nanodegree--nd000,months,160.0
"Kaggle, AWS","Learn advanced machine learning techniques and algorithms and how to package and deploy your models to a production environment. Gain practical experience using Amazon SageMaker to deploy trained models to a web application and evaluate the performance of your models. A/B test models and learn how to update the models as you gather more data, an important skill in industry. ",2,10,3.0,0,nd009t,726.0,0,91.9284,School of Artificial Intelligence,"Machine Learning, Supervised Learning, Unsupervised Learning, Deep Learning",Become a Machine Learning Engineer,https://www.udacity.com/course/machine-learning-engineer-nanodegree--nd009t,months,120.0
"Google, Hootsuite, HubSpot, MailChimp, Moz, Facebook","Learn to create marketing content, use social media to amplify your message, make content discoverable in search, run Ads campaigns and advertise on Facebook. Additionally, learn how display and video ads work and how to market with email, and measure and optimize with Google Analytics.",1,10,3.0,0,nd018,1675.0,0,93.9104,School of Business,"Digital Marketing, Social Media Marketing, Facebook Marketing, Search Engine Optimization, Search Engine Marketing, Display Ads, Search Ads",Become a Digital Marketer,https://www.udacity.com/course/digital-marketing-nanodegree--nd018,months,120.0
