collaboration,description,difficulty,hours_per_week,number_weeks_months,free,id_course,n_reviews,new,rating,school,skills,title,url,time_range,duration_total_hours"Gradle, Google",,0,0,6.0,1,ud867,0.0,0,,School of Programming & Development,"Android Development, Gradle, Java",Gradle for Android and Java,https://www.udacity.com/course/gradle-for-android-and-java--ud867,",weeks,",
Google,,0,0,3.0,1,ud898,0.0,0,,School of Programming & Development,"Native JavaScript Promises, Asynchronous code, Advanced error handling, Generating sequences of async work",JavaScript Promises,https://www.udacity.com/course/javascript-promises--ud898,",weeks,",
Georgia Institute of Technology,,2,0,1.0,1,ud741,0.0,0,,School of Artificial Intelligence,"Randomized Optimization, Clustering, Feature Selection, Feature Transformation, Information Theory",Machine Learning: Unsupervised Learning,https://www.udacity.com/course/machine-learning-unsupervised-learning--ud741,",months,",
,,2,0,3.0,1,ud981,0.0,0,,School of Business,"Variable Reduction, Clustering Models design",Segmentation and Clustering,https://www.udacity.com/course/segmentation-and-clustering--ud981,",weeks,",
Google,,0,0,4.0,1,ud825,0.0,0,,School of Programming & Development,"Android Development, Performance, Optimization",Android Performance,https://www.udacity.com/course/android-performance--ud825,",weeks,",
,,0,0,3.0,1,ud774,0.0,0,,School of Programming & Development,"Debugging, LLDB",Xcode Debugging,https://www.udacity.com/course/xcode-debugging--ud774,",weeks,",
Google,,2,0,2.0,1,ud882,0.0,0,,School of Programming & Development,"Responsive Images, Mobile Image debugging, Creating responsive graphics",Responsive Images,https://www.udacity.com/course/responsive-images--ud882,",weeks,",
Google,,1,0,4.0,1,ud836,0.0,0,,School of Programming & Development,"Android Development, Java, Object Oriented Programming, Conditional Code, Methods, Variables",Android Basics: User Input,https://www.udacity.com/course/android-basics-user-input--ud836,",weeks,",
Google," Learn product validation, UI/UX practices, Google’s Design Sprint and the process for setting and tracking actionable metrics. ",2,0,,1,ud509,0.0,0,,School of Business,"Product Design, Design Sprints, Ideation and Validation, UI/UX",Product Design,https://www.udacity.com/course/product-design--ud509,months,
,,0,0,6.0,1,ud989,0.0,0,,School of Programming & Development,"Separating concerns, Code organization, Using an Organizational Library, KnockoutJS",JavaScript Design Patterns,https://www.udacity.com/course/javascript-design-patterns--ud989,",weeks,",
,,2,0,4.0,1,ud953,0.0,0,,School of Artificial Intelligence,"Algebra, Python, Vectors, Intersections",Linear Algebra Refresher Course,https://www.udacity.com/course/linear-algebra-refresher-course--ud953,",months,",
,,0,0,3.0,1,ud421,0.0,0,,School of Programming & Development,"Networking, URLSession, JSON Parsing",iOS Networking with Swift,https://www.udacity.com/course/ios-networking-with-swift--ud421,",months,",
Alteryx,,1,0,2.0,1,ud976,0.0,0,,School of Business,Linear Regression,Problem Solving with Advanced Analytics,https://www.udacity.com/course/problem-solving-with-advanced-analytics--ud976,",weeks,",
Alteryx,,2,0,2.0,1,ud978,0.0,0,,School of Business,"Binary Classication Models, Non-Binary Classification Models",Classification Models,https://www.udacity.com/course/classification-models--ud978,",weeks,",
Google,,1,0,2.0,1,ud839,0.0,0,,School of Programming & Development,"Android Development, Intents and Activities, Data, Loops and Custom Classes, Images and Visual Polish, Audio and Libraries",Android Basics: Multiscreen Apps,https://www.udacity.com/course/android-basics-multiscreen-apps--ud839,",months,",
Alteryx,,1,0,2.0,1,ud977,0.0,0,,School of Business,"Data Issues, Data Formatting, Data Blending",Creating an Analytical Dataset,https://www.udacity.com/course/creating-an-analytical-dataset--ud977,",weeks,",
Google,,2,0,1.0,1,ud884,0.0,0,,School of Programming & Development,"Chrome Developer Tools, DOM and CSSOM, Critical Rendering Path HTML, CSS and JavaScript optimizations",Website Performance Optimization,https://www.udacity.com/course/website-performance-optimization--ud884,",weeks,",
,,1,0,1.0,1,ud808,0.0,0,,School of Programming & Development,"Android, Android Studio, Java",How to Install Android Studio,https://www.udacity.com/course/how-to-install-android-studio--ud808,",day,",
Google,,0,0,8.0,1,ud894,0.0,0,,School of Programming & Development,"Single Page Applications, Building Angular apps, Building Ember apps, Underscore's template function, Backbone events and routing",Front End Frameworks,https://www.udacity.com/course/front-end-frameworks--ud894,",weeks,",
Google,,2,0,3.0,1,ud723,0.0,0,,School of Business,"Prototyping, User Research, inVision",Rapid Prototyping,https://www.udacity.com/course/rapid-prototyping--ud723,",weeks,",
Google,,2,0,2.0,1,ud893,0.0,0,,School of Programming & Development,"Responsive design patterns, Remote debugging and emulation, Optimizing layout, CSS media queries, CSS flexbox",Responsive Web Design Fundamentals,https://www.udacity.com/course/responsive-web-design-fundamentals--ud893,",weeks,",
Google,,2,0,3.0,1,ud892,0.0,0,,School of Programming & Development,"Installing Sublime Text, Installing Plugins, Gulp, Live Editing, ESLint",Web Tooling & Automation,https://www.udacity.com/course/web-tooling-automation--ud892,",weeks,",
,,0,0,16.0,0,ud9876,0.0,1,,School of Autonomous Systems,Georgia Institute of Technology,Cyber-Physical Systems Design & Analysis,https://www.udacity.com/course/cyber-physical-systems-design-analysis--ud9876,",weeks,",
,,1,0,1.0,1,ud595,0.0,0,,School of Programming & Development,"Command line interface (Linux server), Terminal and Shell (GNU Bash), Linux filesystem, Shell commands",Linux Command Line Basics,https://www.udacity.com/course/linux-command-line-basics--ud595,",weeks,",
Nutanix,,2,0,1.0,0,ud0321,0.0,1,,School of Cloud Computing,"Hybrid Cloud, Nutanix, Hyperconverged Infrastructure, Prism web console, Private Cloud, Virtual Machine",Hybrid Cloud Fundamentals,https://www.udacity.com/course/hybrid-cloud-fundamentals--ud0321,",month,",
Microsoft,,1,0,1.0,0,ud091,0.0,1,,School of Programming & Development,"Microsoft Power Platform, Power Apps, Power Automate, Azure AI Builder",Microsoft Power Platform,https://www.udacity.com/course/microsoft-power-platform--ud091,",month,",
,"In this program, you’ll learn foundational data skills, gain an in-depth understanding of Google Analytics and marketing analytics. You’ll learn to analyze data and build models with Excel, Data Studio, and create informative data visualizations with Tableau.",1,5,3.0,0,nd028,251.0,1,93.7849,School of Business,"Google Analytics, Excel & Spreadsheets, Data Visualization, Customer Segmentation",Become a Marketing Analyst,https://www.udacity.com/course/marketing-analytics-nanodegree--nd028,months,60.0
,"In this course you will learn data structures and algorithms by solving 80+ practice problems. You will begin each course by learning to solve defined problems related to a particular data structure and algorithm. By the end of each course, you would be able to evaluate and assess different data structures and algorithms for any open-ended problem and implement a solution based on your design choices.",2,10,4.0,0,nd256,586.0,1,92.62799999999999,School of Programming & Development,"Data Structures and Algorithms, Problem Solving, Interview Practice Problems, Python",Data Structures and Algorithms,https://www.udacity.com/course/data-structures-and-algorithms-nanodegree--nd256,months,160.0
,,1,0,2.0,0,ud080,0.0,1,,School of Cloud Computing,"Cloud Computing,  AWS Console,  Compute Services,  Serverless Architecture,  Cloud Databases",Intro to Cloud Computing,https://www.udacity.com/course/intro-to-cloud-computing--ud080,",months,",
,"You’ll learn the core concepts required to design and develop robots that fly. You’ll work with the quadrotor test platform and our custom flight simulator to implement planning, control, and estimation solutions.",0,15,4.0,0,nd787,190.0,1,91.2632,School of Autonomous Systems,"3D Motion Planning, Controls, Estimation, Kalman Filters",Flying Car and Autonomous Flight Engineer,https://www.udacity.com/course/flying-car-nanodegree--nd787,months,240.0
,"In this Nanodegree program, you'll learn how to build declarative user interfaces for the web with React, and for iOS and Android with React Native. You'll also learn how to manage state more predictably in your applications with Redux.",2,10,4.0,0,nd019,919.0,0,92.8183,School of Programming & Development,"React, Redux, React Native",Become a React Developer,https://www.udacity.com/course/react-nanodegree--nd019,months,160.0
,"You will start by learning the basics of iOS app development using the Swift programming language and Xcode, Apple's development environment. You'll develop your first iOS apps using layouts, views, UIKit, and more. Then, you’ll progress to build more complex and advanced applications, using networking, and Apple’s Grand Central Dispatch and Core Data, and will be ready to publish your capstone project to the App Store.",2,10,6.0,0,nd003,748.0,1,92.3529,School of Programming & Development,"Swift programming, Core Data, UIKit, iOS networking, app publishing, User interfaces, Local Persistence, APIs",Become an iOS Developer,https://www.udacity.com/course/ios-developer-nanodegree--nd003,months,240.0
,"Get hands-on experience by coding five real-world projects. Learn to build a route planner using OpenStreetMap data, write a process monitor for your computer, and implement your own smart pointers. Finally, showcase all your newfound skills by building a multithreaded traffic simulator and coding your own C++ application.",2,10,4.0,0,nd213,629.0,1,90.7154,School of Autonomous Systems,"Data Structures & Algorithms, Memory Management, Concurrency, Object Oriented Programming, C++",Become a C++ Developer,https://www.udacity.com/course/c-plus-plus-nanodegree--nd213,months,160.0
"Unity, Nvidia Deep Learning Institute","Learn cutting-edge deep reinforcement learning algorithms—from Deep Q-Networks (DQN) to Deep Deterministic Policy Gradients (DDPG). Apply these concepts to train agents to walk, drive, or perform other complex tasks, and build a robust portfolio of deep reinforcement learning projects.",0,15,4.0,0,nd893,345.0,1,93.7391,School of Artificial Intelligence,"Reinforcement Learning, Neural Networks, PyTorch, Deep Q-Networks (DQN), Deep Deterministic Policy Gradients (DDPG)",Become a Deep Reinforcement Learning Expert,https://www.udacity.com/course/deep-reinforcement-learning-nanodegree--nd893,months,240.0
WorldQuant,"Learn the basics of quantitative analysis, including data processing, trading signal generation, and portfolio management. Use Python to work with historical stock data, develop trading strategies, and construct a multi-factor model with optimization.",2,10,6.0,0,nd880,465.0,1,91.6989,School of Artificial Intelligence,"Momentum Trading Strategy, Smart Beta, Alpha Factors, Natural Language Processing, Deep Learning, Neural Networks",Artificial Intelligence for Trading,https://www.udacity.com/course/ai-for-trading--nd880,months,240.0
"Alteryx, Tableau",Learn to apply predictive analytics and business intelligence to solve real-world business problems.,1,10,3.0,0,nd008,366.0,0,94.0437,School of Business,"Data Wrangling, Classification, A/B Testing, Forecasting, Segmentation",Predictive Analytics for Business,https://www.udacity.com/course/predictive-analytics-for-business-nanodegree--nd008,months,120.0
"Amazon Alexa, IBM Watson","Learn cutting-edge natural language processing techniques to process speech and analyze text. Build probabilistic and deep learning models, such as hidden Markov models and recurrent neural networks, to teach the computer to do tasks such as speech recognition, machine translation, and more!",0,15,3.0,0,nd892,375.0,1,90.72,School of Artificial Intelligence,"Machine Learning, Speech Recognition, Sentiment Analysis, Machine Translation, Part of Speech Tagging",Become a Natural Language Processing Expert,https://www.udacity.com/course/natural-language-processing-nanodegree--nd892,months,180.0
,"Learn the essential foundations of AI: the programming tools (Python, NumPy, PyTorch), the math (calculus and linear algebra), and the key techniques of neural networks (gradient descent and backpropagation).",1,10,3.0,0,nd089,810.0,1,92.3704,School of Artificial Intelligence,"Python, NumPy, Pandas, Matplotlib, PyTorch",AI Programming with Python,https://www.udacity.com/course/ai-programming-python-nanodegree--nd089,months,120.0
,"Begin your exploration into the world of robotics software engineering with a practical, system-focused approach to programming robots using the ROS framework and C++. In addition, learn and apply robotics software engineering algorithms such as localization, mapping, and navigation.",0,15,4.0,0,nd209,391.0,1,91.0998,School of Autonomous Systems,"C++, ROS, Localization, Mapping, SLAM, Navigation, Path Planning, Robot Operating System, Robotics",Become a Robotics Software Engineer,https://www.udacity.com/course/robotics-software-engineer--nd209,months,240.0
Google,We built this curriculum with Google for aspiring Android developers who are new to programming to ensure that you get the real-world skills you need to know how to build and accelerate your journey towards becoming a professional Android Developer.,1,10,3.0,0,nd803,3045.0,0,96.8407,School of Programming & Development,"Android Development, Java programming, Android Studio, XML layouts, Android Views",Android Basics by Google,https://www.udacity.com/course/android-basics-nanodegree-by-google--nd803,months,120.0
,"Learn to write programs using the foundational AI algorithms powering everything from NASA’s Mars Rover to DeepMind’s AlphaGo Zero. You’ll master Beam Search and Random Hill Climbing, Bayes Networks and Hidden Markov Models, and more.",0,15,3.0,0,nd898,237.0,1,90.7173,School of Artificial Intelligence,"AI Algorithms, Search Algorithms, Optimization, Planning, Pattern Recognition",Expand Your Knowledge of Artificial Intelligence,https://www.udacity.com/course/ai-artificial-intelligence-nanodegree--nd898,months,180.0
,"Learn the fundamentals of the blockchain platform. Create your own private blockchain, and secure a digital asset using blockchain identity. Explore the Ethereum platform, and use Solidity and smart contracts to develop your own decentralized app.",2,10,4.0,0,nd1309,182.0,1,89.1209,School of Programming & Development,"Ethereum Blockchain, Blockchain Architecture, Data Auditing",Become a Blockchain Developer,https://www.udacity.com/course/blockchain-developer-nanodegree--nd1309,months,160.0
"Affectiva, Nvidia Deep Learning Institute","Learn cutting-edge computer vision and deep learning techniques—from basic image processing, to building and customizing convolutional neural networks. Apply these concepts to vision tasks such as automatic image captioning and object tracking, and build a robust portfolio of computer vision projects.",0,15,3.0,0,nd891,582.0,1,93.2646,School of Artificial Intelligence,"Convolutional Neural Networks (CNN), Recurrent Neural Networks (RNN), Simultaneous Localization and Mapping (SLAM), Object Tracking, Image Classification, Deep Learning",Become a Computer Vision Expert,https://www.udacity.com/course/computer-vision-nanodegree--nd891,months,180.0
,"In this program, you’ll sharpen your Python skills, apply C++, apply matrices and calculus in code, and touch on computer vision and machine learning. These concepts will be applied to solving self-driving car problems. At the end, you’ll be ready for our Self-Driving Car Engineer Nanodegree program!",2,10,4.0,0,nd113,597.0,0,93.3333,School of Autonomous Systems,"Computer Vision, Machine Learning, Vehicle Motion, Control",Intro to Self-Driving Cars,https://www.udacity.com/course/intro-to-self-driving-cars--nd113,months,160.0
,"Start by learning the fundamentals of cloud development and deployment with AWS. Then, build different apps leveraging microservices, Kubernetes clusters, and serverless application technology. ",2,10,4.0,0,nd9990,502.0,1,88.24700000000001,School of Cloud Computing,"AWS, Microservices, Serverless Architecture, Kubernetes",Become a Cloud Developer,https://www.udacity.com/course/cloud-developer-nanodegree--nd9990,months,160.0
Mercedes-Benz,"Learn to detect obstacles in lidar point clouds through clustering and segmentation, apply thresholds and filters to radar data in order to accurately track objects, and augment your perception by projecting camera images into three dimensions and fusing these projections with other sensor data. Combine this sensor data with Kalman filters to perceive the world around a vehicle and track objects over time.",0,10,4.0,0,nd313,198.0,1,95.0505,School of Autonomous Systems,"Perception, Lidar, Radar, Sensors, Computer Vision",Become a Sensor Fusion Engineer,https://www.udacity.com/course/sensor-fusion-engineer-nanodegree--nd313,months,160.0
Appen,"You’ll learn how to evaluate the business value of an AI product. You’ll start by building familiarity and fluency with common AI concepts. You’ll then learn how to scope and build a data set, train a model, and evaluate its business impact. Finally, you’ll learn how to ensure a product is successful by focusing on scalability, potential biases, and compliance. 

Along the way, you’ll review case studies and examples to help you focus on how to define metrics to measure the business value for a proposed product. ",1,10,2.0,0,nd088,368.0,1,85.8696,School of Artificial Intelligence,"AI Products, Training ML Models, Annotating Datasets, Prototyping a Product",Become an AI Product Manager,https://www.udacity.com/course/ai-product-manager-nanodegree--nd088,months,80.0
"Tableau, Mode","In this program, you’ll learn foundational data skills that apply across functions and industries. You’ll learn to analyze data and build models with Excel, query databases using SQL, and create informative data visualizations with Tableau.",1,10,3.0,0,nd098,1093.0,1,94.9314,School of Business,"Excel & Spreadsheets, SQL, Data Visualization, Data Dashboards",Business Analytics,https://www.udacity.com/course/business-analytics-nanodegree--nd098,months,120.0
,"Learn to design and deploy infrastructure as code, build and monitor CI/CD pipelines for different deployment strategies, and deploy scalable microservices using Kubernetes. At the end of the program, you’ll combine your new skills by completing a capstone project.",2,10,4.0,0,nd9991,465.0,1,91.5699,School of Cloud Computing,"AWS, Configuration Management with Ansible, Continuous Integration / Continuous Deployment, Microservices with Kubernetes, CloudFormation",Become a Cloud Dev Ops Engineer,https://www.udacity.com/course/cloud-dev-ops-nanodegree--nd9991,months,160.0
"Kaggle, AWS","Learn foundational machine learning algorithms, starting with data cleaning and supervised models. Then, move on to exploring deep and unsupervised learning. At each step, get practical experience by applying your skills to code exercises and projects.
",2,10,3.0,0,nd229,331.0,1,94.8036,School of Artificial Intelligence,"Introduction to Machine Learning, Supervised Learning, Deep Learning, Unsupervised Learning",Intro to Machine Learning with PyTorch,https://www.udacity.com/course/intro-to-machine-learning-nanodegree--nd229,months,120.0
,"You’ll start by building data visualizations and dashboards, considering your audiences to be as effective as possible. Then, you’ll move into drafting presentations using storytelling techniques, visualizations, and animations to provide data-driven recommendations. ",1,10,4.0,0,nd197,136.0,1,93.5294,School of Data Science,"Data Visualization, Tableau, Dashboards, Data Storytelling",Data Visualization,https://www.udacity.com/course/data-visualization-nanodegree--nd197,months,160.0
,"Learn how to process data in real-time by building fluency in modern data engineering tools, such as Apache Spark, Kafka, Spark Streaming, and Kafka Streaming.

You’ll start by understanding the components of data streaming systems. You’ll then build a real-time analytics application. Students will also compile data and run analytics, as well as draw insights from reports generated by the streaming console.",0,10,2.0,0,nd029,130.0,1,83.0769,School of Data Science,"Data Streaming, Spark, Kafka, Kafka Streaming, Spark Streaming",Data Streaming ,https://www.udacity.com/course/data-streaming-nanodegree--nd029,months,80.0
,"Learn back-end development with the Java programming language, one of the most popular programming languages in the world and one a majority of large enterprises rely on for their infrastructure.  ",2,10,4.0,0,nd035,128.0,1,83.9063,School of Programming & Development,"Java, Spring Boot, Rest API, MySQL, MongoDB",Become a Java Web Developer,https://www.udacity.com/course/java-developer-nanodegree--nd035,months,160.0
Mode,"Learn the programming fundamentals required for a career in data science. By the end of the program, you will be able to use R, SQL, Command Line, and Git.",1,10,3.0,0,nd118,51.0,1,94.5098,School of Data Science,"R, SQL, Git",Programming for Data Science with R,https://www.udacity.com/course/programming-for-data-science-nanodegree-with-R--nd118,months,120.0
,"The goal of the Front End Web Developer Nanodegree program is to equip learners with the unique skills they need to build and develop a variety of websites and applications. Graduates of this Nanodegree program will be able to construct responsive websites using CSS, Flexbox and CSS Grid, develop interactive websites and UI (User Interface) applications using JavaScript and HTML, and connect a web application to backend server data using JavaScript. Students will also build competency automating application build and deployment using Webpack and improving offline performance of websites using Service Worker.",2,10,4.0,0,nd0011,784.0,1,93.1122,School of Programming & Development,"JavaScript, HTML, CSS, Webpack, Flexbox, Node, Object-Oriented Programming",Front End Web Developer,https://www.udacity.com/course/front-end-web-developer-nanodegree--nd0011,months,160.0
"Kaggle, AWS","Learn foundational machine learning algorithms, starting with data cleaning and supervised models. Then, move on to exploring deep and unsupervised learning. At each step, get practical experience by applying your skills to code exercises and projects.
",2,10,3.0,0,nd230,243.0,1,93.4979,School of Artificial Intelligence,"TensorFlow, Deep Learning, scikit-learn, Supervised Learning, Unsupervised Learning",Intro to Machine Learning with TensorFlow,https://www.udacity.com/course/intro-to-machine-learning-with-tensorflow-nanodegree--nd230,months,120.0
BMW,"You’ll develop foundational technical knowledge of machine learning and the business applications of artificial intelligence across industries. Through practical case studies, you’ll learn what strategic questions to ask, and how to formulate proposals when evaluating opportunities to embed machine learning processes and artificial intelligence technology into a corporate strategy. Finally, in the capstone project, you will build an AI-backed strategy that can be integrated into your own business.",2,5,4.0,0,nd054,0.0,1,,School of Business,"Artificial Intelligence, Machine Learning, Business Strategy, Data Labeling, Data Modeling",AI for Business Leaders,https://www.udacity.com/course/ai-for-business-leaders--nd054,weeks,20.0
,"The goal of the Full Stack Web Developer Nanodegree program is to equip learners with the unique skills they need to build database-backed APIs and web applications. A graduate of this program will be able to design and build databases for software applications, create and deploy database-backed web APIs, and secure and manage user authentication and access control for an application backend. Students will also learn how to deploy a Flask-based web application to the cloud using Docker and Kubernetes.",2,10,4.0,0,nd0044,492.0,1,90.935,School of Programming & Development,"Python, JavaScript, PostgreSQL, Flask, Docker, Kubernetes",Full Stack Web Developer,https://www.udacity.com/course/full-stack-web-developer-nanodegree--nd0044,months,160.0
,"Play a critical role in an organization’s cloud computing strategy as an AWS Cloud Architect. Learn to plan, design, and implement secure cloud infrastructure in AWS at scale. Begin by designing and building high availability infrastructure, and then move on to building scalable, secure, and cost-optimized architecture. Finally, explore and execute best practices and strategies around securing access to cloud services and infrastructure. 

",0,10,3.0,0,nd063,111.0,1,94.5946,School of Cloud Computing,"Cloud Infrastructure, Cloud Security, AWS, CloudFormation, High Availability Infrastructure, Serverless Computing",Become an AWS Cloud Architect,https://www.udacity.com/course/aws-cloud-architect-nanodegree--nd063,months,120.0
